paper_id,title,tldr,abstract,year
155867063,A GLANCE OF FISHERMEN'S COOPERATIVE SOCIETIES OF VARIOUS COUNTRIES AROUND THE GLOBE,"The main objective of this paper was to take review of fishermen's cooperative societies around the world. The review outcomes indicate that cooperative societies with strong financial support succeed in the development of cooperative. The problems associated with fishermen's cooperative societies were fishing disputes, degree of honesty by the members, lack of capital, shortage of adequately trained and well motivated fisheries extension workers, etc.","All over the world, fisheries is promising activity. More than three billion people depend directly or indirectly on fisheries. As the people's involvement in this sector was enormous, they need to serve efficiently and effectively. Keeping in mind, fishermen's come themselves together and established their own cooperative society to meet needs and to flourish the business activity. The main mandate of fishermen's cooperative society was to help their members in all business activities socially, economically and technologically. The main objective of this paper was to take review of fishermen's cooperative societies around the world. The review outcomes indicate that, cooperative societies with strong financial support succeed in the development of cooperative. Fish marketing has received priority among all activities, and societies involved in fish marketing activities were found flourished. Apart from marketing, the successful societies have engaged in other business activities like insurance, banking, supplies, exports, etc. Management of societies by state officials or persons without adequate knowledge and experience in fisheries has been a failure. Among the problems associated with fishermen's cooperative societies were fishing disputes, degree of honesty by the members, lack of capital, shortage of adequately trained and well motivated fisheries extension workers, etc.",2015.0
155867136,Selection of the Bank Investment Strategy on the Basis of the Hierarchy Analysis Method,"The article offers a hierarchical structure of decision making, which could be a basis of selection of the bank's investment strategy. The prospect of further study is development of an optimisation model of the bank's investment portfolio with consideration of market flexibility.","The goal of the article lies in identification of a methodical approach to selection of the investment strategy of banks on the basis of factors of its formation with the use of the hierarchy analysis method. Factors of formation of the bank's investment strategy were identified in the result of the study. The article demonstrates that selection of the investment strategy of the bank could be efficiently realised on the basis of the hierarchy analysis method, which is the most popular under conditions of a multi-criteria assessment of the search for optimal solution of the set task. The article offers a hierarchical structure of decision making, which could be a basis of selection of the bank's investment strategy with consideration of the institutional flexibility. The prospect of further study in this direction is development of an optimisation model of the bank's investment portfolio with consideration of not only institutional, but also market flexibility of decision making.",2014.0
155868212,EVALUASI KETEPATAN DISTRIBUSI RASKIN DI KECAMATAN BANGUNTAPAN KABUPATEN BANTUL,"This research aims to find out accuracy of the target distribution, timing, quantity and quality of Raskin in Banguntapan. Raskin received by RTS only able to meet the needs of domestic rice consumption amounting to 51.22% per month.","Data ::: This research aims to find out accuracy of the target distribution, timing, quantity, ::: price, administration and quality of Raskin in Banguntapan and find out how ::: much assistance Raskin can meet the needs of the average rice Household Target ::: (Rumah Tangga Sasaran/RTS) in Banguntapan. Methods used is a descriptive ::: analysis by interviewing 50 recipients of Raskin were selected by random ::: sampling. The data was tested by T test. The results showed that the accuracy rate ::: of the distribution of Raskin in Banguntapan from indicators of accuracy that ::: have been defined in the general guidelines do not meet the 6 indicator accuracy. ::: Only four indicators that can filled, which targeted by poverty line of BPS, right ::: price at the distribution point, right at time and right at administration. To be ::: targeted by the poverty line belongs Sayogyo inappropriate because the amount of ::: spending per capita equal to rice in each target households vary widely. ::: comparison between the number of poor households and the number of Raskin ::: recipients is known that the number of recipients more than the number of ::: households in Banguntapan, so its not on target. The purchase price of Raskin at ::: the point of distribution in accordance with the conditions set by Bulog. But In ::: this research redeemed price to the point there is a difference in price of about Rp ::: 100/kg to Rp 200/kg that used to transport costs from one place to another. ::: Amount of Raskin that received by each RTS amounted to an average of 9.22 kg ::: and the Raskin are normal qualified. Raskin received by RTS only able to meet ::: the needs of domestic rice consumption amounted to 51.22% per month.",2013.0
155868390,"Macroeconomic Stability, Financial Risks and Market Eciency: Evidence for a Small and Open Economy",We find that the dynamics of local financial risks is associated with the evolution of the overall economic conditions of the country. The ability of domestic stock prices to reflect fundamentals information improves during times of stable external conditions.,"We analyze whether changes in external macroeconomic conditions are associated with changes in the dynamics of risk and changes in the degree of informativeness of the price system for the Chilean economy. By focusing our analysis in Chile, we hope to isolate the effect of external macroeconomic volatility from the effects that weak institutions or a poor rule of law might have over domestic markets performance. We find that the dynamics of local financial risks is associated with the evolution of the overall economic conditions of the country, with a strong reduction in idiosyncratic and systematic risks during periods of stable macroeconomic conditions. Since the level and composition of financial risks can affect the net benefits of acquiring and trading on private information, we conjecture that external economic conditions can also affect the informativeness of domestic stock prices. We find that the ability of domestic stock prices to reflect fundamentals information improves during times of stable external conditions. In spite of this, we provide evidence that traditional measures of informationally market efficiency in the R2 literature fail to detect such changes and attempt to explain the reason behind the inability of these measures to properly proxy for stock price informativeness.",2013.0
158470666,Immigrants’ employment and the business cycle in Spain: taking account of gender and origin,"This paper provides an empirical overview of the relationship between the business cycle and the immigrant employment cycle in Spain, differentiating by gender and origin. We find that in the Spanish economic upturns, the labour market is more prone to creating immigrant males’ employment than females’, while in the downturns females’ employment shows more resilience.","The purpose of this paper is to provide an empirical overview of the relationship between the business cycle and the immigrant employment cycle in Spain, differentiating by gender and origin, during the period 1999–2017. The study focuses on three main goals. First, we identify and compare the phases and the main features of the female and male immigrant employment cycles and the business cycle by means of their turning points. This target also includes the analysis of the differences in the cyclical pattern between immigrants’ and natives’ employment. Second, we wonder to what extent the global financial crisis initiated in the middle of 2007 modified the cyclical fluctuations of immigrants’ employment and whether female and male employment presents significant differences. Finally, we study whether immigrants’ origin plays some role in employment fluctuations during the pre- and crisis periods. We find that in the Spanish economic upturns, the labour market is more prone to create immigrant males’ employment than females’, while in the downturns females’ employment shows more resilience. With regard to the natives, immigrants remain unemployed longer in downturns and are laid off before the economy reaches its peak. However, a stronger gain of immigrants’ employment appears to be present in periods of expansion and a weaker loss in periods of contraction. In the contraction periods, immigrant females present the highest chances of keeping their employment.",2018.0
158470741,"Ghislain Deleplace, Ricardo on Money. A Reappraisal",Ghislain Deleplace's book is a comprehensive study of Ricardo on money.,"In writing this book Ghislain Deleplace had a clear purpose in mind, namely to show that Ricardo “was not only a giant on value, distribution, and accumulation, but on money too” and this dictated his strategy, which amounts to “providing a comprehensive study of Ricardo on money, to rehabilitating him as a theorist, accounting for all his monetary writings, and suggesting his relevance for modern analysis” (5). The book is divided into three parts: I. History, presenting an overview of the f...",2018.0
158472489,Searching for profit-shifting in China,"The authors exploit the flat-rate structure of China's corporate income tax, along with its system of targeted, preferential rates, to estimate the relationship between profits and tax rates. Their sample consists of approximately 60,000 observations of foreign-owned MNCs from the years 2005-2009.","This paper investigates profit-shifting behaviour among multinational corporations (MNCs) in China. The authors exploit the flat-rate structure of China's corporate income tax, along with its system of targeted, preferential rates, to estimate the relationship between profits and tax rates. Their sample consists of approximately 60,000 observations of foreign-owned MNCs from the years 2005-2009. Using the traditional approach of regressing before-tax profits on tax rates, the authors find evidence consistent with profit-shifting. However, this approach is suspect because the nature of China's tax preferences makes it especially vulnerable to omitted variable bias. Accordingly, the authors employ finite mixture modelling to search for the existence of a group of profit-shifting MNCs. While their analysis identifies two types of firms, subsequent investigation failed to produce any evidence linking these to profit-shifting behavior. Robustness checks exploiting the panel nature of the dataset, along with further investigation of investment-tax elasticities, confirm the authors' null finding of profit-shifting. One reason for the lack of profit-shifting among Chinese MNCs may be that corporate tax rates were relatively low during this period.",2018.0
158472501,Urban Development and Mass Killing: A First Look at the Data,This chapter presents the empirical research design adopted to test our main hypothesis. We discuss how we constructed and our annual 0.5-degree grid cell-year sample of nondemocratic states. We conduct a large-N statistical analysis of the association between our urban development per capita measure and the likelihood of mass killing campaigns by 0.5-degree grid cell in nondemocratic regimes.,"This chapter presents the empirical research design adopted to test our main hypothesis. We discuss how we constructed and our annual 0.5-degree grid cell-year sample of nondemocratic states and explain why this grid cell-year framework is appropriate for testing our main hypothesis. This is followed by a description of how we operationalized our dependent variable and one of the independent variables—namely, urban development per capita at the grid cell-year level. Finally, we conduct a large-N statistical analysis of the association between our urban development per capita measure and the likelihood of mass killing campaigns by 0.5-degree grid cell in nondemocratic regimes.",2018.0
158473172,"When, why and how institutional change takes place: a systematic review and a future research agenda on the importance of policy entrepreneurship in macroeconomic bureaucracies",Political science and public policy scholars have long emphasised the importance of understanding institutional change and policy entrepreneurship.,AbstractPolitical science and public policy scholars have long emphasised the importance of understanding institutional change and policy entrepreneurship. This review article is a response to this...,2017.0
158473381,Adoption and impact of improved maize varieties on maize yields: Evidence from central Cameroon,The study examines adoption of improved maize varieties in central Cameroon.,"This study uses both the endogenous switching regression and propensity score matching models to analyze the adoption and impact of improved maize varieties on maize yields in central Cameroon. The results show that (i) education level, agricultural training, proximity to an Institute of Agricultural Research for Development branch and farmers’ perceptions of yield and risk of improved maize varieties significantly affect the adoption of improved maize varieties and (ii) the adoption of improved maize varieties enhances maize yields. Therefore, policies designed to stimulate adoption of improved maize varieties should be promoted. Improvement of access to school and agricultural training may serve as good strategies for promoting the adoption of improved maize varieties in Cameroon.",2019.0
158474156,The effect of CEO civic engagement on corporate social and environmental performance,The purpose of this paper is to explore the relationship between a CEO’s personal engagement in broader societal causes (CEO civic engagement) and firm’s social and environmental performance. The findings suggest firms led by CEOs with active civic engagement are more likely to support various philanthropic efforts.,"Purpose ::: ::: ::: ::: ::: The purpose of this paper is to explore the relationship between a chief executive officer (CEO)’s personal engagement in broader societal causes (CEO civic engagement) and firm’s social and environmental performance. ::: ::: ::: ::: ::: Design/methodology/approach ::: ::: ::: ::: ::: A theoretical framework was developed based on upper echelons and stakeholder theories to argue that CEOs’ professional background characteristics can be closely related to firm-level social and environmental performance. Hierarchical OLS analysis was conducted using data from 178 large, publicly traded large US firms between 2010 and 2013. ::: ::: ::: ::: ::: Findings ::: ::: ::: ::: ::: Overall, the findings suggest that firms led by CEOs with active civic engagement are more likely to support various philanthropic efforts. Additionally, the findings suggest that firms led by civic-minded CEOs are more likely to support an active corporate environmental engagement by investing significant resources in various environmental causes. Contrary to the authors’ predictions, the level of CEO civic engagement was not a significant predictor of firm level community engagement activities. ::: ::: ::: ::: ::: Research limitations/implications ::: ::: ::: ::: ::: The findings extend current scholarly work on executive determinants of corporate social performance by highlighting the important role of CEOs’ personal engagement beyond studying CEOs’ demographic characteristics. Specifically, the findings that the CEO-civic engagements lead to higher degrees of corporate philanthropy and environmental performance show that CEOs’ civic engagement can go beyond what is considered symbolic executive actions. ::: ::: ::: ::: ::: Practical implications ::: ::: ::: ::: ::: The findings suggest that firms that seek to foster social and environmental performance in a meaningful way should recruit and retain CEOs that have a personal commitment to and engagement in various social and environmental issues and causes. ::: ::: ::: ::: ::: Originality/value ::: ::: ::: ::: ::: By empirically examining the effect of CEO civic engagement on corporate philanthropy, community involvement and environmental performance, this paper seeks to contribute to the scholarly conversation on the effects of CEOs in shaping the firm’s social and environmental engagement and addressing external stakeholder concerns.",2019.0
158476108,The Cultural Value of Protected Areas as Models of Sustainable Development,"Our paper investigates reference models for integrating economic, social and environmental perspectives of sustainable development. We take into consideration protected areas as models of sustainable development by means of a case study. Findings highlight the cultural value of protected areas as models of sustainable development leveraging territorial governance on the basis of a systems approach.","In recognition of the urgent need to drive the transition to truly sustainable development, it is our belief that the divisions still distinguishing economic, social and environmental dimensions of human activities can impede the creation of conditions for sustainable development. Our paper investigates reference models for integrating such economic, social and environmental perspectives of sustainable development, proposing a systems approach. We take into consideration protected areas as models of sustainable development by means of a case study, discussing (1) the need to integrate the economic, social and environmental dimensions of human activity; and (2) opportunities offered by protected areas as reference models for promoting sustainable development in the wider surrounding territory. Findings highlight the cultural value of protected areas as models of sustainable development leveraging territorial governance on the basis of a systems approach.",2018.0
158476172,Do trade agreements increase Vietnam's exports to RCEP markets?,The paper reviews recent developments in trade relations between Vietnam and members of the Regional Comprehensive Economic Partnership (RCEP) and ASEAN+1 FTAs on Vietnam's major exports. The results show that the effects of tariff preferences differ between the types of preferences and products. The tariff preferences do not exert a stimulating effect on the export of agricultural products but have positive effects on several manufacturing exports such as garments and footwear.,"The paper reviews recent developments in trade relations between Vietnam and members of the Regional Comprehensive Economic Partnership (RCEP) agreement, and analyses the impacts on Vietnam's exports of tariff reductions in RCEP trading partners. The margin of tariff preferences is adopted as a proxy for the degree of trade liberalisation and a gravity model is used to assess the impacts of the tariff preferences under the AFTA and ASEAN+1 FTAs on Vietnam's major exports. The results show that the effects of tariff preferences differ between the types of preferences and products. The FTA tariff preferences do not exert a stimulating effect on the export of agricultural products but they have positive effects on several manufacturing exports such as garments and footwear.",2018.0
158476922,Strategic learning for digital market pioneering: Examining the transformation of Wishberry's crowdfunding model,We develop an integrative framework that identifies strategic learning and its impact on the digital model adopted by the firm. The insights for this study extend the theoretical frameworks of strategic learning to the context of market pioneers.,"Abstract Pioneering digital firms are often built on novel business models that differentiate them from their competition. Striving for the right business model is a challenge for entrepreneurs. In their digital endeavors, firms often experiment with multiple business models before converging on to a specific, focused model that they choose to pursue. An intriguing question in this domain is how do digital market pioneers gain strategic knowledge for the transformation of their business models? We develop an integrative framework that identifies strategic learning and its impact on the digital model adopted by the firm, as a core driver for business model transformation. We examine this framework through a case study of Wishberry, a crowdfunding startup in India that was the pioneer in this domain in India. Its active scanning of the business environment led to strategic learnings that helped transform its business model which was at the core of its sustained market advantages. The insights for this study, which are primarily focused on digital entrepreneurship, extend the theoretical frameworks of strategic learning to the context of market pioneers. The learnings from this study will help entrepreneurs design agile business models that are reactive to market needs.",2019.0
158477613,"Analysis of Principles and Practice of APLUC in Anambra State, Nigeria",This study analyzed Anambra State land-based taxes with a view to ascertaining the principles and objectives behind them. The paper identified various land-based taxes and in order to determine the principle and practice behind them.,"Land taxation is any levy that is land -based. Land based taxes abound in Anambra State and they include: Companies income and Personal income Tax, Value Added Tax, Capital Gains Tax, Capital Transfer Tax, Stamp Duties and recently the Land Use Charges. In an ideal situation, land –taxes actas tool to manage land use, urban density and expansion, discourage speculative transactions and encourage sustainable development. This study analyzed Anambra State land –based taxes with a view to ascertaining the principles and objectives behind them. The paper identified various land – based taxes and in order to determine the principle and practice behind them. The study adopted a survey design to generate data from respondents(landlord and tenants).To examine the principles and practice of land based taxes in Anambra State, questionnaires were administered on Estate surveyors and Tax Assessors. They were entreated to give their views on property rate practice and Land use charge law in Anambra State. A percentage of their responses to the questions were taken to measure the weight of their views. They opined that for a land based tax to be progressive, equity and fairness should be emphasized as the major objective and not just revenue as seen in the land –based taxation in Anambra State. They were also of the view that increased land values which an owner enjoys are not due to his efforts but that of government as supported by public funds and a good tax system should amongst all seek to redistribute this wealth by upholding the principle of equity and fairness, together with other principles.",2017.0
158478840,Trade unions as retaining walls against political change: A Gramscian approach to remunicipalisation policies in a Spanish City,The 2008 economic crisis in Spain produced a favourable opportunity for left-wing projects and trade union strategies.,"The 2008 economic and political crisis produced a favourable opportunity structure for the emergence of new and innovative left-wing political projects and trade union strategies in Spain, especial...",2018.0
156781117,Trade Preferences for Developing Countries and the WTO,"This report includes the trade preferences and General Agreement on Tariffs and Trade (GATT) Most-favored-nation (MFN) requirements, World Trade Organization waivers for preferential trade agreements, and U.S. preference programs.","This report discusses the trade preferences and General Agreement on Tariffs and Trade (GATT) most-favored-nation (MFN) requirements, World Trade Organization (WTO) waivers for preferential trade agreements, and WTO waivers for U.S. preference programs.",2007.0
156781824,Problems and Solutions: Collective Bargaining in China,Collective bargaining is an important mechanism to modify industrial relations in market-oriented economy. The development of collective bargaining systems depends on whether we select agreement self-government model or the government play the major role in it.,"Collective bargaining is an important mechanism to modify industrial relations in market-oriented economy. It is also the effectively basic and major means for regulating and modifying labor relations in west countries. Not only does collective bargaining establish the level of employee's wage and benefits, but also serves as an important means of conflict resolution. The basic of bringing the modifying effect of collective bargaining into play is to resolve the problem in implementation of collective bargaining in our country. Collective bargaining is not only a means to ensure the implementation of present laws, but also an important measure of establishing new rules. The development of collective bargaining systems depends on whether we select agreement self-government model or the government play the major role in it.",2004.0
