paper_id,title,tldr,abstract,year
154421157,A Case of Cultural Forgetting: Black Newspapers' Presentation of Black Baseball in 1932,"Negro National League officials agreed to close operations for 1932 due to hard realities of the Great Depression. The Negro Southern League and the newly-created East-West Colored League became black baseball's ""major leagues""","When Negro National League officials agreed to close operations for 1932 due to the hard realities of the Great Depression, the usually minor Negro Southern League and the newly-created East-West Colored League became black baseball's ""major leagues."" (1) Disillusionment with the Negro National League collapse, apprehension about the ability of the leagues to complete a season, complications of player trade disputes, and low attendance figures led to a muddled portrait of black baseball in 1932. The black press only fed the disillusionment and apprehension of its readers, aiding what would become a historiographical lapse in coverage of the season. Their initial bias and eventual apathy only added further confusion as they attempted to clarify the championships, legitimacy, and politics of the foundering Negro Leagues. The topography of baseball newspaper reporting in 1932 is herein defined through the analysis and statistical sampling of a set of nineteen black newspapers. Those newspapers are then divided into various regional locations in some instances and circulation coverage areas in others (see table 1). The sample is largely the result of availability. Each of the newspapers listed in table 1 provides either complete or near-complete surviving coverage for the 1932 calendar year. Availability, of course, necessarily omits some publications that would immensely benefit such a study. Nashville, Tennessee, and Monroe, Louisiana, for example, play significant roles in the 1932 season, yet the black newspapers for those cities (the Nashville Globe and Independent and the Southern Broadcast, respectively) no longer survive. (2) Only the Negro Southern League (NSL) completed league play for a full season. The East-West folded before the close of the season's first half. As a consequence, the statistical analysis only treats coverage of the NSL. The categorizations and calculations that follow all stem from the original core list of nineteen newspapers. (3) That core list greeted the 1932 season--particularly the formation of the assumed major league concentrated in the northeast, the East-West Colored Baseball League--with skepticism. As early as July 9, the Baltimore Afro-American reprinted a John L. Clark article originally written for the West Penn Service that insinuated that the league's organizer, Cumberland Posey, was forming the league as a countermeasure to the success of the Pittsburgh Crawfords. (4) Posey's Homestead Grays (a Pittsburgh team) competed for dollars and notoriety with their crosstown rival, and the mogul's attempt to form the league was, for Clark, a direct attempt to omit the competition from league play. His critique went further. Clark charged that ""Washington, Newark, New York, Norfolk, and Kansas City are likely to be excluded. In spite of the fact that Cleveland and Detroit [included teams] had poor gate attractions last year, they will get preference over the five teams just mentioned. They will be preferred because Cum can dictate to them, which fact dovetails with the prime objective."" W. A. Greenlee, owner of the Crawfords, echoed Clark's sentiments in late February. ""You probably know,"" wrote Greenlee in a widely published letter to the press, ""that Posey's interest in a league came after the Crawfords had their first successful playing season."" The criticism seemed valid, as Posey purchased a controlling interest in the East-West Detroit entry and stocked the team with Homestead players. (5) TABLE 1.1932 Black press sample set, divided by region and circulation SOUTH NORTH BORDER WEST Memphis Indianapolis Recorder Louisville California World Leader Eagle Shreveport Chicago Defender Kansas City Houston Sun Call Informer Louisiana Pittsburgh Courier Baltimore Weekly Atlanta Daily New York Amsterdam Afro-American World News Birmingham New York Age Negro Reporter World Philadephia Tribune Boston Chronicle Cleveland Gazette NATIONAL EDITIONS REGIONAL EDITIONS Atlanta Daily World Memphis World Philadelphia Tribun Chicago Defender Shreveport Sun Boston Chronicle Pittsburgh Courier Louisiana Weekly Cleveland Gazette New York Amsterdam News Birmingham Reporter Louisville Leader Baltimore Afro-American Indianapolis Recorder Houston Informer California Eagle New York Age Negro World Kansas City Call The league began with weekday games and Sunday doubleheaders, with a planned split schedule. …",2009.0
154421177,The faces of liberal capitalism: Anglo-Saxon banking systems in crisis?,The recent financial crisis has shaken confidence in the conventional wisdom of economic liberalism. The sharply divergent experiences of the four main Anglo-Saxon banking systems suggest that the crisis may not so much be one of liberal capitalism per se as it is of neoclassical variety that characterises the British and American systems.,"The recent financial crisis has severely shaken confidence in the conventional wisdom of economic liberalism, giving rise to debate about the appropriate direction of theory and policy. In this context, the sharply divergent experiences of the four main Anglo-Saxon banking systems suggest that the crisis may not so much be one of liberal capitalism per se as it is of the neoclassical variety that characterises the British and American systems. Whereas these banking systems were very badly affected by the crisis, the Canadian and Australian systems were not. Our analysis suggests that this can be explained by differences in the way that economic liberalism was interpreted and translated into policy in the four countries during the period preceding the crisis. It also suggests that broad classifications of national business systems into 'liberal market' and other varieties of capitalism do not capture their inherent diversity, and that financial market liberalisation does not necessarily lead to instability, particularly when it is accompanied by appropriate supervision and prudential regulation. Copyright The Author 2012. Published by Oxford University Press on behalf of the Cambridge Political Economy Society. All rights reserved., Oxford University Press.",2012.0
154421434,Welfare Analytics in General Equilibrium Theory: An Improved Geometry,In a stable model the rate of investment will also fall and the firm will converge on its optimal size. In a stable model the rate of investment will also fall and the firm will converge on its optimal size.,"ment again falls; in a stable model the rate of investment will also fall and the firm will converge on its optimal size. It is also possible, as in the separable case, for DKt to remain constant or even increase. In this note we have presented a reasonably simple geometric interpretation of the dynamic analysis of the firm. In addition, adjustment costs, while initially introduced to restrict the rate of investment of the firm by introducing a tradeoff between alternative growth rates, have been shown to be very important also in determining the equilibrium size of the firm.",1976.0
154421527,A framework for improving environmental management: Beyond the market mechanism,Economists have begun to examine the potential of market and fiscal policy interventions for improving environmental management among small farmers. Most interventions emphasize institutions and policies rather than the strategies and choices of the rural poor.,Abstract Economists have begun to examine the potential of market and fiscal policy interventions for improving environmental management among small farmers. These approaches can be criticized for failing to reflect both the “demand” and “supply” side of the equation. Most interventions emphasize institutions and policies rather than the strategies and choices of the rural poor. Important moves to improve resource accounting and to remove disincentives to better environmental management will have unpredictable effects if the perspectives of most environmental managers are not considered on the “demand” side of the equation.,1992.0
154421569,Energiaturpeen käytön taloudellinen merkitys suomessa,The study also analyses the potential effects of changes of taxation of peat in the 1990s. The heavier taxation of peat has decreased the energy use of peat especially during the latter half of the 1990s.,"The purpose of this study is to evaluate the changes in peat production and taxation of peat in the 1990’s. The study also analyses the potential effects of changes of taxation of peat. The taxation of peat, as well as energy taxation in general, has been continuously increasing. At the same time, subsidies on peat production have in practice been discontinued. The heavier taxation of peat has decreased the energy use of peat especially during the latter half of the 1990’s. Simultaneously, the liberalisation of the electricity markets has decreased the price of electricity, reducing the competitiveness of peat in electricity production. In a ‘wood scenario’, the CO2 component of the energy tax on peat would be decreased to the same level as the tax on wood, whereas in a ‘coal scenario’, the CO2 component would be raised to the level of the tax on coal. The ‘wood scenario’ results in higher peat consumption and lower coal consumption and, to some degree, also lower wood consumption than current taxes. Employment in peat production would be increased only slightly, however. The ‘coal scenario’ would clearly decrease the consumption of peat. Employment in peat production would be decreased by several hundreds of man years. The changes in the structure of energy taxation would not, however, have significant macroeconomic effects. – Peat ; production of electricity ; production of heat ; carbon dioxide tax ; carbon dioxide emissions ; GHG-balance",2000.0
154421858,"The real exchange rate, sectoral allocation and development in China and East Asia: A simple exposition","Global macroeconomic imbalances are among the key issues facing policymakers, especially in the US and China. This paper offers a simple analytical exposition of some of the issues relating to China’s and East Asian development and their impact on global imbalances using a two-sector tradable and nontradables model.","Global macroeconomic imbalances are among the key issues facing policymakers, especially in the US and China which are the two major affected / contributing parties. While there has been a great deal of discussion and disagreement on this important issue, what all sides have in common is the general failure to adequately pay attention to the role of the exchange rate in allocating resources internally between tradables and nontradables. These sectoral changes can have both real and macroeconomic consequences. This paper offers a simple analytical exposition of some of the issues relating to China’s and East Asian development and their impact on global imbalances using a two-sector tradable and nontradables model.",2012.0
154422200,Targeting New Markets.,"recruiting students from new sources requires a sound knowledge of marketing, solid research, and institutional activities. recruiting students from new sources requires a sound knowledge of marketing, solid research, and institutional activities.","Often necessary to meet enrollment goals in a competitive age, recruiting students from new sources requires a sound knowledge of marketing, solid research, effective organization, and institutional activities that will attract the desired populations.",1990.0
154422583,"Opportunity Cost, Trade Policies and the Efficiency of Firms","This paper analyzes the effects of trade policies on the technological effort of a firm entering a new market in the context of a developing country. In the case of linear demand function and constant returns to scale technology, protection is shown to unambiguously reduce the protected firm's technological effort.","Abstract This paper analyzes the effects of trade policies on the technological effort of a firm entering a new market in the context of a developing country. We depart from previous literature by bringing into focus the opportunity cost of technological effort. A firm that spends time in acquiring a more efficient technology delays the commercialization of its products, thus incurring an opportunity cost in terms of profits forgone. Protection increases both the opportunity cost and the benefits from technological effort. In the case of linear demand function and constant returns to scale technology, protection is shown to unambiguously reduce the protected firm's technological effort. Export subsidy is also shown to reduce technological effort when the potential level of exports under free trade is high.",2000.0
154422745,International Vertical Integration: A Positive Model of Endogenous Structure,This paper provides a simple theoretical model in which a vertically-distorted industry structure is considered in an international setting.,"This paper provides a simple theoretical model in which a vertically-distorted industry structure is considered in an international setting. Fixed costs, existing in both the final good and intermediate good sectors, result in a bilateral externality. Production as well as equity ownership potentially crosses national boundaries. Differing parameter specifications give rise to various market structures as industrial organization is endogenous to the model. As a result, marginal changes in parameter specifications may lead to jumps in plant ownership and location decisions.",1994.0
154423058,"Economic Growth and Institutions: Some Sensitivity Analyses, 1961 2000","This study uses econometrics to estimate the effect of objectively measurable institutions. Some institutions associated with the organization of labor and capital are robust correlates of investment. Few data support the view that variables related to the organization of the state, including fiscal federalism and political regime-type, affect macroeconomic performance.","Do institutions help explain macroeconomic performance? This article addresses two issues. First, especially given the practical implications of the literature, measurement of institutions should avoid tautologies, and therefore this study uses econometrics to estimate the effect of objectively measurable institutions such as labor market organization, financial development, fiscal federalism, and political regime-type. Second, the growing literature on these promising factors, in turn, is unfortunately incommensurable because previous studies fail to control for other institutional and, in some cases, standard economic variables. Given data on up to ninety-four countries from 1961 through 2000, extreme-bound analysis (EBA), an econometric technique that addresses the sensitivity of previous findings to alternative assumptions about model specification, suggests that some institutions associated with the organization of labor and capital are robust correlates of investment. Few data support the view that variables related to the organization of the state, including fiscal federalism and political regime-type, affect macroeconomic performance. Without implication, the author thanks Richard Nelson, Doug Chalmers, Robert Shapiro, Alessandra Casella, Brendan O'Flaherty, Geoffrey Garrett, Alexander Hicks, Brett Hammond, Mark Kesselman, the editor (Lisa Martin), and two anonymous referees for helpful comments. Also, Ross Levine, Peter Rousseau, Geoffrey Garrett, and Torben Iversen were very helpful in locating data. The views expressed in this article do not necessarily reflect those of the Board of Governors of the Federal Reserve System or any member of its staff.",2004.0
154423502,Food safety issues and the BSE scare: some lessons from the French case,"The paper outlines a survey conducted in the area of Rennes to analyse consumer behaviour after the BSE crisis. The study concludes with the interests and limits of the method used, and the implications of the BSE scare on food policy.","Abstract The Bovine Spongiform Encephalopathy (BSE) scare began after the UK Minister of Health admitted a possible link between the BSE prion and the Creutzfeldt-Jakob disease contaminating humans. The paper outlines a survey conducted in the area of Rennes to analyse consumer behaviour after the BSE crisis. A contingent scenario was proposed to determine the willingness to pay (WTP) for beef which should not transmit CJD using a mix of the referendum method and the bidding process. The variables considered as main determinants of the WTP have been selected. The study concludes with the interests and limits of the method used, and the implications of the BSE scare on food policy. In fact, the `mad cow' disease raises the problem of loss of public confidence and the means to restore it. Consumers are waiting for a greater transparency or `traceability' and, according to the survey, would accept to pay for it.",1998.0
154423935,Survival of a Culture: Tibetan Refugees in India,Tibetans who fled to India are not ordinary refugees. The survival of Tibetan culture in the Indian diaspora is one of the wondrous events of our time. The survival of Tibetan culture in the Indian diaspora is one of the wondrous and hopeful events of our time.,"Throughout human history there has always been a flow of persecuted and dislocated people. Today, in the age of totalitarianism, that flow has become a flood. In our time, millions have fled from reigns of terror in their homelands seeking refuge and a new life in another society and culture. Most have no other choice but to escape from intolerable threat and danger, to break with the bonds of their heritage and try to become part of a different national tradition, contributing some of their own values to the new country of their choice. For most of them, their past is gone, their life has changed under the pressure of new demands caused by the need for assimilation. In that sense Tibetans who fled to India are not ordinary refugees. They have taken refuge not as individuals alone, but rather as a national polity that has escaped the destruction taking place in Tibet and has sought and been given the protective mantle of a neighboring friendly country. Both a people and cultural institutions have taken refuge in a host setting and have demonstrated both strength and survivability. That is the extraordinary and unique story of the Tibetans in India, a story that demonstrates the vitality of the Tibetan culture and of the people-the one hundred thousand who fled with their leader, the Dalai Lama, from Tibet across the Himalayas to the safety of a land with its own great religious tradition, a land originally the major source of Tibetan Buddhism. India, the land of Gandhi and the land where the Buddha once lived, was the best sanctuary Tibetan polity could have found. Clearly, the survival of Tibetan culture in the Indian diaspora is one of the wondrous and hopeful events of our time. Twenty-six years ago, when the Dalai Lama arrived in India after his incredible escape from Lhasa over the high Himalayan mountain passes,",1985.0
154424152,"Mutual benefit societies in Hungary, 1830-1941","For most of the nineteenth century mutual benefit societies played a key role in providing social groups with aid in case of illness, accident, disability or death. They flourished from the 1870s to the decade preceding the First World War.","In Hungary for most of the nineteenth century mutual benefit societies played a key role in providing various social groups with aid in case of illness, accident, disability or death. The majority were linked to the burgeoning working-class movement and were voluntary associations whose members had no other recourse in times of adversity. Hungary was undergoing transformation in the nineteenth century. Changes in goods production and the craft guilds accelerated the establishment of workers’benefit societies, and so did the lack of a coherent system of social insurance in the new industrial order. They grew in tandem with the expansion of Hungary's economy and the return of constitutional government in 1867, and flourished from the 1870s to the decade preceding the First World War. Austria and Germany provided theoretical justifications and practical models. By the 1890s voluntary mutual benefit societies faced increasing competition from the State. As the economy and social structures evolved, successive governments sponsored their own insurance programmes. By the turn of the century, private companies were also offering life and accident insurance and the appeal of mutual benefit societies to both workers and the middle class diminished. Between the two world wars, they continued to serve a substantial segment of the population.",1993.0
154424997,A simulation system for corporate planning,"The package consists of a system of computer programs written in the BASIC language for a Digital PDP 11/70 time-sharing computer. The framework upon which the package is based is essentially an amalgamation of the System Dynamics and Input-Output approaches to the modelling of complex organizations. The package is designed to provide planning managers with the ability to construct flexible models, localized or ‘corporate computation’, financial or non-financial.","Abstract This paper describes the structure and use of a general purpose simulation package developed for the interactive construction of dynamic computer-based simulation models. The package consists of a system of computer programs written in the BASIC language for a Digital PDP 11/70 time-sharing computer. The framework upon which the package is based is essentially an amalgamation of the System Dynamics and Input-Output approaches to the modelling of complex organizations. Networks of levels and flows provide the basis for dynamic, modular representation, while matrix algebra features provide the basis for aggregational flexibility and the analysis of multi- product multi-process industrial systems. The package is designed to provide planning managers with the ability to construct flexible models, localized or ‘corporate’, financial or non-financial, without the need for any programming in the conventional sense. A flow diagram of the system to be modelled guides the model builder in responding to computer terminal prompts which determine the model structure as a set of programmed relationships. This in turn gives rise to a further series of prompts at the terminal for the entry of all data pertinent to the model. Model editing and computation then proceeds, with user interaction, if desired, for amendments, monitoring of computations, and report generation. Two specific applications of the package are discussed in the latter part of the paper, and sample output from runs of both of the resultant models is provided.",1980.0
154425512,Adoption and economics of multiple sustainable intensification practices in Ethiopia: Evidence from panel data,"This paper examines adoption and impacts of combinations of cropping system intensification practices in Ethiopia. The results show that conservation tillage, cropping system diversification, and modern varieties increase household income when adopted individually or in combination. We find ‘win-win’ outcomes - the highest payoffs and the lowest applications of agro-chemicals when all these intensification practices are adopted jointly.","This paper examines adoption and impacts of combinations of cropping system intensification practices - cropping system diversification, conservation and modern varieties - using nationally representative panel farm household survey data collected in 2010 and 2013 in Ethiopia. We adopted a multinomial endogenous switching regression in an impact evaluation framework to control for selection bias caused by observed and unobserved heterogeneities. The results show that conservation tillage, cropping system diversification, and modern varieties increase household income when they are adopted individually as well as in combination. However, the impact is greater when they are adopted in combination. We find ‘win-win’ outcomes - the highest payoffs and the lowest applications of agro-chemicals when all these intensification practices are adopted jointly. The results suggest that policies and programs aimed at promoting adoption of multiple cropping system intensification practices can have both economic as well as environmental benefits.",2015.0
154425747,A Decade After the Asian Financial Crisis: Regionalism and International Architecture in a Globalized World,The rise of Asia to the center of the global political economy has been met by neither helter-skelter Asian regionalism nor U.S. strategic inattentiveness of the past decade.,The China-driven rise of Asia to the center of the global political economy since the Asian financial crisis under systems of political economy manifestly different from those of the Washington Consensus poses a challenge that has been met by neither helter-skelter Asian regionalism nor by American strategic inattentiveness of the past decade.,2007.0
