paper_id,title,tldr,abstract,year
154220706,Optimal positioning of safety stocks in MRP,"The positioning of safety stock is considered in multi-echelon production networks operating in an MRP environment. We show that in serial networks the optimal policy positions all safety stock at the end of stock-point. This result is independent of the nature of the demand, the type of uncertainty and the measure of service used.","The positioning of safety stock in multi-echelon production networks operating in an MRP environment is considered. Our aim is to maximize the service level achieved for a given total amount of safety stock. Most previous research considering MRP environments has been empirical or heuristic, but the approach we take is analytic and concentrates on two network types: serial and divergent networks. Using previous results on the MRP ordering logic, we show that in serial networks the optimal policy positions all safety stock at the end stock-point. This result is independent of the stochastic nature of the demand, the type of uncertainty and the measure of service used. The analysis of divergent networks is more complicated because of the need for material rationing. We show that the optimal policy may depend on the total amount of safety stock available, the variability of the demand, the structure of the lead times, the choice of the rationing policy and the measure of service used.",1993.0
154220806,"Risk preferences in multi-period consumption models, the equity premium puzzle, and habit formation utility",The relationship between the relative risk aversion measure for the utility function for consumption and that for the value function for wealth is a derived relationship that depends on how consumption and wealth are defined and measured.,"Abstract The relationship between the relative risk aversion measure for the utility function for consumption and that for the value function for wealth is a derived relationship whose properties depend on how consumption and wealth are defined and measured. This fact together with information concerning estimates for these two relative risk aversion measures is used to give another perspective on the equity premium puzzle, and to explain why it is that the habit formation utility function is effective in eliminating that puzzle. A time separable utility function that can serve as an alternative to the assumption of habit formation is also presented.",2005.0
154220811,A Study of Debt Structure Preference Based on Controlling Shareholders’ Benefits of Control,This paper makes an empirical study on the debt structure preference of enterprises in which controlling shareholders have the right of control.,"Taking data of all A-share listed companies in Shanghai Stock Exchange and Shenzhen Stock Exchange from 2002 to 2006 as samples, this paper makes an empirical study on the debt structure preference of enterprises in which controlling shareholders have the right of control. Results show that these enterprises: (1) prefer to short-term debt financing concerning the debt maturity structure; (2) prefer to financing by loaning from banks concerning the debt type structure; (3) prefer to high-priority debt structure concerning the debt priority.",2009.0
154220863,Assessing Alternative Policies for Reducing Household Waste in Taiwan,The three major cities in Taiwan have been experimenting with two different demand-side management approaches to reduce the waste generated by households. The fee-per-bag program is clearly the most effective approach.,"In the last few years, the three major cities in Taiwan have been experimenting with two different demand-side management approaches to reduce the waste generated by households and to promote the recycling of recyclables. Thus, there are three different kinds of approaches of waste management that are concurrently used in Taiwan: fee-per-bag, mandatory recycling with free waste collection services, and the zero price of trash collection. We performed a comparative analysis of these policy instruments to take advantage of this important social experiment. We first developed an economic model for the three different waste charging programs concurrently in use and then performed an empirical study based on the implications from the theoretical analysis. It is clearly seen that the traditional approach of zero pricing of trash collection is very ineffective in terms of waste reduction and recycling. Households have all changed their behavior significantly in those cities with two new approaches. However, of the two, the fee-per-bag program is clearly the most effective approach. The results have important policy implications.",2004.0
154221057,RML: market intelligence in India with mobile SMS intervention,"RML is best suited to teach undergraduates and graduates in the areas of rural marketing, agribusiness management, service management and information and communication technology. India is changing with great pace by inclusive growth on espousal of technology into the mainstream.","Title – RML: market intelligence in India with mobile SMS intervention.Subject area – Agriculture knowledge, market intelligence, emerging business model.Study level/applicability – It is best suited to teach undergraduates and graduates in the areas of rural marketing, agri‐business management, service management and information and communication technology for development.Case overview – India is changing with great pace by inclusive growth on espousal of technology into the mainstream. Indian farmers are wholly depending even now on traditional methods for decision making on entire agriculture supply chain. The constant decision making provides middle men with a chance to exploit and empower themselves on the returns produced by farmers. Technology is creating waves providing an opportunity for farmers to benefit by adopting information and technology to solve their basic livelihood problems. The Thomson Reuter group launched a SMS‐based mobile information service to support India's 250‐million‐strong ...",2011.0
154221100,The Effect of Mining on Agricultural Hired Labor in the Northern Great Plains,Aim is to define the supply and demand for hired agricultural labor in the Northern Great Plains. No need is seen for a major legislative remedy because the benefits of formula pricing outweigh perceived problems. Elimination of formula risks changing the competitive balance and structure of the markets.,"The nature of the market for hired agricultural labor in the Northern Great Plains is estimated with particular reference to adjustments attendant to energy development. Specific objectives include: (a) specification of a regional labor market model defining the supply and demand for hired agricultural labor; (b) assessment of the importance of wages in agriculture and mining in explaining the supply of labor to agriculture, with empahsis on the plausibility of mining growth as an incentive for the transfer of labor out of agriculture; and (c) comparison of these results with earlier supply and demand studies for agricultural labor. No need is seen for a major legislative remedy because the benefits of formula pricing generally outweigh the perceived problems. The major concern seems to be suspicions of price manipulation or unrepresentative price reports. Eliminations of the formula risks changing the competitive balance and structure of the markets. 17 references.",1980.0
154221262,Stock price effects of asset securitization: The case of liquidity facility providers,"We analyze the effects of asset securitization announcements on the market value of banks involved in the transaction. We find that abnormal returns occur around the announcement dates, and that they are positively related to the respective bank's liquidity.","We analyze the effects of asset securitization announcements on the market value of banks involved in the transaction as liquidity facility providers. Based on a unique sample of 97 European securitization transactions undertaken between 2002 and 2010, we find that abnormal returns occur around the announcement dates, and that they are positively related to the respective bank's liquidity. Moreover, abnormal returns tend to be negative for transactions involving high-risk portfolios, and they have decreased significantly after the global financial crisis. Our results suggest that providing liquidity facilities in securitization transactions is considered value relevant information by equity investors, and that bank management may even be able to infer the likely sign of the market reaction based on the respective bank's characteristics, and current business environment.",2015.0
154221439,Structural Change in Factor Substitution in Finnish Manufacturing,"The possibility of structural change in Finnish factor substitution relations is analyzed. The initial point of transition is 1974, during which the first energy crises took place.","The possibility of structural change in Finnish factor substitution relations between energy and nonenergy factors is analyzed. The standard generalized Leontief KLEMF cost functions is modified so that the substitution parameters related to electricity and fuel factors may shift to new levels over time. The initial point of transition is 1974, during which the first energy crises took place. Likelihood ratio tests confirm that there has indeed been a statistically significant change in energy versus nonenergy substitution. The authors' estimates imply stronger substitutability for most input pairs after the energy crisis. Copyright 1989 by The editors of the Scandinavian Journal of Economics.",1989.0
154221851,Determinants of audit committee formation in the life insurance industry: New Zealand evidence,"The study examines the determinants of audit committee formation in life insurance firms. The variables organizational form, assets-in-place, and reinsurance were not statistically significant.","Abstract This study examines empirically the determinants of audit committee formation in life insurance firms. The study tests six hypotheses, namely whether the existence of audit committees is related to organizational form, firm size, leverage, assets-in-place, reinsurance, and total monitoring costs, using pooled 1991–1993 data gathered from New Zealand's life insurance industry (100 firm/year observations), parameter estimates were derived using fixed-effects regression. The model X 2 is found to be reasonably consistent with that reported in prior studies. The empirical results indicate that consistent with expectations, audit committees appear to be positively associated with large entities, companies with high leverage, and firms with high total monitoring expenditures. However, the variables organizational form, assets-in-place, and reinsurance were not statistically significant. The study thus provides mixed empirical results.",1997.0
154222019,The Spillover Effects of the Global Crisison Economic Activity in Mena Emerging Market Countries: An Analysis Using the Financial Stress Index,The estimated spillover of the global crisis to emerging market economies is attributable to direct or indirect spillovers of financial stress in advanced economies. The increased financial stress and slowdown in economic activity in advanced economies can explain about half of the drop in real GDP growth in MENA EM countries after the Lehman shock.,"The estimated spillover of the global crisis to emerging market (EM) economies in the Middle East and North Africa (MENA) indicates that nearly two-thirds of the increased financial stress in MENA EM countries after the Lehman shock is attributable to direct or indirect spillovers of financial stress in advanced economies. Moreover, the estimated models suggest that the increased financial stress and slowdown in economic activity in advanced economies can explain about half of the drop in real GDP growth in MENA EM countries after the Lehman shock.",2010.0
154222509,Earnings Management and Measurement Error,I consider the impact of a noisy indicator regarding a manager's manipulative behavior on optimal effort incentives and the extent of earnings management. The principal uses the indicator variable to prevent earnings management only under conditions where manipulative behavior is not excessive.,"In this paper I consider the impact of a noisy indicator regarding a manager's manipulative behavior on optimal effort incentives and the extent of earnings management. The analysis in this paper extends a twotask, single performance measure LEN model by including a binary random variable. I show that contracting on the noisy indicator variable is not always useful. More specifically, the principal uses the indicator variable to prevent earnings management only under conditions where manipulative behavior is not excessive. Thus, under conditions of excessive earnings management, accounting adjustments that yield a more congruent overall performance measure can be more effective than an appraisal of the existence of earnings management to mitigate the earnings management problem.",2008.0
154223031,Wind energy in China: policy options for development,"Wind energy potential ranks highly in the world scale. In the key wind energy regions, there is potential to develop a succession of large wind-farms. In the '90s the government target of 1 GW for the wind-power capacity to be installed by the year 2000 was lowered to 620 MW.","China's wind energy potential ranks highly in the world scale. In the key wind energy regions, there is potential to develop a succession of large wind-farms of up to several hundreds of MW capacity. In the '90s the government target of 1 GW for the wind-power capacity to be installed by the year 2000 was lowered to 620 MW. In 1994, three government bodies, the then State Planning Commission, the State Science and Technology Commission, and the State Economic and Trade Commission, created the long-term Development Programme for Renewable Energies for the years 1996–2010. In 1996, the new Electricity Law of the PRC, declared “… the State encourages and supports electricity generation by using renewable and clean energy resources”. However, key energy objectives of China's Ninth Five Year Plan (1996–2000) reflected the continuing dominance of coal, oil and gas in China's energy policy-making. Between 1993 and 1997, wind generating capacity installed in China had risen from 17.1 to only 167 MW, while capital and operating costs for wind generated electricity (1998) were still too high in relation to coal and hydro generation. The 10th-Five Year Plan aims to promote more environment-friendly power generation including hydropower development in the western region. The plan will allocate more natural gas and renewable energy for power generation. With no value being ascribed to inherent cleanliness of wind energy, electricity produced from this relatively immature sector continues to need higher prices than that from entrenched, mature fossil-fuel-based power generation. In China this has contributed to a perception that wind is a niche-market resource, primarily relevant to remote rural areas which conventional power grids are not able to reach economically. Expansion of wind energy to a larger role runs into opposition from newly liberalised power networks who are more than ever concerned, and required, to keep the cost of supplies as low as possible. Within these limitations, some success has been and still is being achieved in buying down the costs through technical and scalar innovation in a growing number of grant-aided projects. For greater penetration to be achieved, a market needs to be created for wind energy. There is recent evidence in Europe and the United States that realistic incentives can encourage industry to consider much larger wind-power development projects with consequent improvement to the economics. Competitive bidding from wind-energy development companies can ensure that the targets are met at lower cost. A system of competitive bidding for licence areas (or concessions) for areas big enough to support very large wind-power plants, and chosen from prime wind regions by government, can be issued, regularly for bidding, as in oil and gas development. An accompanying institutional framework such as the renewable portfolio standard (RPS) is essential. China is considering introducing a trial mandated market share (MMS) intervention, based on RPS for a selected region to assess its applicability to both China nationally and the renewable energy sector as a whole. There is a case for enactment of an encompassing Renewable Energy Law, which will provide a point focus for regulating renewable energy development, setting any RPS/MMS levels within time-frames and with all related modalities, including green certificate trading. An electricity price in the region of 4.5–5.0 USC/kWh will also need to be achieved when power purchase agreements are negotiated, if the bidding process is to achieve success. Local production of hardware needs to lower capital costs by an estimated 25–30% of current (2000) costs if economic returns are to be sufficient at these price levels. A concessionary approach, linked with a renewable portfolio standard law and aimed at large projects, can help achieve a faster development and a rapid buy-down of costs of wind energy technology.",2001.0
154223130,Averting crisis? Assessing measures to manage financial integration in emerging economies,The Asian crisis provides heterodox economists with the opportunity to investigate counterfactually whether financial policies would have averted the crisis. The paper concludes with policies to avert future crises.,"The Asian crisis provides heterodox economists with the opportunity to investigate counterfactually whether the financial policies they have proposed would have averted the crisis. The paper argues that neo-liberal financial integration introduces distinct risks to emerging economies--currency, flight, fragility, contagion and sovereignty risks. The paper presents the financial policies endorsed by the heterodoxy--transactions taxes, trip wires and-or speed bumps, convertibility restrictions, the Chilean model and a publicly managed mutual fund. The paper considers whether these policies mitigate risks, and whether they could have prevented the Asian crisis (and the transmission thereof). The paper concludes with policies to avert future crises. Copyright 2003, Oxford University Press.",2003.0
154223211,The short-run price-performance dynamics of microcomputer technologies,Short-run growth models are arguably more useful for managers and research scientists. Our research explores short-run growth in microcomputer technologies with weekly data. We expect results to contribute to more accurate price-performance forecasting at the corporate and product level.,"Abstract Models of technology growth are often conceived in terms of long-run trends in performance and price because, in general, short-run parameter stability and even the form of the growth function have proved elusive. Yet short-run growth models are arguably more useful for managers and research scientists, because the majority of their decisions are concerned with discretionary spending and operations rather than longer run strategic plans and investments. Our research explores short-run growth in microcomputer technologies by specifying growth models and parameter estimates for six commercially important computer technologies over short time periods with weekly data. Observations were acquired in a homogeneous market, limited to a collection time frame of less than two years. Data was collected at granular, weekly intervals, with concurrent tests to determine whether parameters were stable over successively longer intervals; conversely candidate growth models from longer ‘strategic’ planning horizons were tested to determine whether they scaled down to operational planning horizons. We found that an exponential model of performance-to-price growth is supported over short time horizons in all but one microcomputer technology (nonvolatile RAM). The exponential model and technology specific parameter estimates that are valid over short horizons were found to accurately scale up to longer planning horizons. We expect our results to contribute to more accurate price-performance forecasting at the corporate and product level; better decision making concerning inventory management, capacity utilization, lead and lag times in supply-chain operations, and efficiency of logistics.",2007.0
154223278,The 2008 oil bubble: Causes and consequences,"We argue that the 2008 Oil Bubble was directly and indirectly created by the Federal Reserve. Deflationary risks first appeared after the dot.com bubble burst in 2000 and after the terrorist attacks on September 11, 2001. Manipulation of the US dollar value has been one of the key emergency tools in the Fed's arsenal. If other global central banks embrace the Fed's anti-deflationary strategies, the consequences could be dire for the global economy.","We argue that ""the 2008 Oil Bubble"" was directly and indirectly created by the Federal Reserve in response to deflationary risks that resurfaced after the housing bubble burst and the resulting credit crisis of 2008. Deflationary risks first appeared after the dot.com bubble burst in 2000 and after the terrorist attacks on September 11, 2001. Manipulation of the US dollar value has been one of the key emergency tools in the Fed's arsenal. During the entire period from 2000 to 2008, the US dollar has been falling, while the price of crude oil has been rising, with the culmination in July 2008. If other global central banks embrace the Fed's anti-deflationary strategies, the consequences could be dire for the global economy, potentially resulting in an ultimate gold bubble.",2010.0
154223421,A tumultuous decade in Thailand: competitive dynamics among domestic banks and multi-national entrants in an emerging market,"This research is a longitudinal exploratory studying the influence that multinational companies (MNC) may have on domestic firms entry rates in an emerging market. The results indicate less predictable competitive dynamics than previous research would suggest, especially in the context of emerging markets. There is also some indication that domestic banks are more responsive to institutional factors within the home country than MNCs.","This research is a longitudinal exploratory studying the influence that multinational company (MNC) entry may have on domestic firm entry rates in an emerging market. Although research on competitive exclusion suggests that MNC entrants present entry barriers to potential smaller domestic entrants, we offer an alternative scenario. That is, MNCs and domestic organisations can co-exist as separate strategic groups within an industry. In particular, when small, potential domestic firms have access to idiosyncratic resources that are less available to MNCs, these smaller entrants were successful in overcoming strong MNC entry barriers. Still, this is circumscribed by the height of entry barriers, but not to the extent alluded to in previous industry organisation analysis research. The results indicate less predictable competitive dynamics than previous research would suggest, especially in the context of emerging markets. There is also some indication that domestic banks are more responsive to institutional factors within the home country than MNCs",2013.0
154223977,The Logic of Policy Change after Crisis : Proximity and Subsystem Interaction,This paper offers a nuanced re-conceptualization of external events and identifies the mechanisms that link disruptive crises to policy change.,"What mechanisms link external events to policy change in a policy subsystem? This paper responds to this question by offering a nuanced re-conceptualization of external events and by identifying the mechanisms that link disruptive crises to policy change. Building from the tenets of the advocacy coalition framework and a synthesis of the crisis management and policy change literatures, this paper (1) introduces the concept of policy and geographical proximity as a means to show how different types of crises alter the incentives for policy action within policy subsystems; (2) discusses an integrated set of proposals on how geographical and policy proximity affects the prospects of change in a policy subsystem; and (3) presents hypothesized scenarios outlining plausible intervening pathways linking a crisis to changes as contingent on policy subsystem structures.",2010.0
154224014,Rural Development in India: A Public Policy Approach,Rural Development in India.,Prologue Rural Development in India An Historical Overview The Community Development Programme Panchayati Raj The Intensive Agricultural District Progamme Concern for the Marginal Man The Drought-Prone Areas Programme The Integrated Rural Development Programme The Jawahar Rojgar Yojana Rural Credit Land Reform Agrarian Unrest Technology for Rural Development Rural Development Bureaucracy Voluntary Organizations and Rural Development Epilogue,1995.0
